{
  "$schema": "../../../schemas/region-index.schema.json",
  "version": 1,
  "country": {
    "country_code": "jp",
    "name": "Japan"
  },
  "region": {
    "region_slug": "hokkaido",
    "name": "Hokkaido"
  },
  "places": [
    {
      "place_slug": "niseko-united",
      "name": "Niseko United",
      "path": "registry/jp/hokkaido/niseko-united/place.json",
      "kind": "resort"
    },
    {
      "place_slug": "rusutsu",
      "name": "Rusutsu Resort",
      "path": "registry/jp/hokkaido/rusutsu/place.json",
      "kind": "resort"
    },
    {
      "place_slug": "kiroro",
      "name": "Kiroro Snow World",
      "path": "registry/jp/hokkaido/kiroro/place.json",
      "kind": "resort"
    },
    {
      "place_slug": "furano",
      "name": "Furano Ski Resort",
      "path": "registry/jp/hokkaido/furano/place.json",
      "kind": "resort"
    },
    {
      "place_slug": "tomamu",
      "name": "Hoshino Resorts TOMAMU",
      "path": "registry/jp/hokkaido/tomamu/place.json",
      "kind": "resort"
    },
    {
      "place_slug": "sapporo-teine",
      "name": "Sapporo Teine",
      "path": "registry/jp/hokkaido/sapporo-teine/place.json",
      "kind": "resort"
    },
    {
      "place_slug": "sahoro",
      "name": "Sahoro Resort",
      "path": "registry/jp/hokkaido/sahoro/place.json",
      "kind": "resort"
    },
    {
      "place_slug": "kamui-ski-links",
      "name": "Kamui Ski Links",
      "path": "registry/jp/hokkaido/kamui-ski-links/place.json",
      "kind": "resort"
    }
  ],
  "ski_domains": []
}
